<?xml version="1.0" encoding="UTF-8"?>
<xs:schema xmlns:xs="http://www.w3.org/2001/XMLSchema">
    <xs:element name="MCQQuestions">
        <xs:complexType>
            <xs:sequence>
                <xs:element name="Question" maxOccurs="unbounded">
                    <xs:complexType>
                        <xs:sequence>
                            <xs:element name="Text" type="xs:string" />
                            <xs:choice maxOccurs="4">
                                <xs:element name="Option">
                                    <xs:complexType>
                                        <xs:simpleContent>
                                            <xs:extension base="xs:string">
                                                <xs:attribute name="isCorrect" type="xs:boolean"
                                                    use="required" />
                                            </xs:extension>
                                        </xs:simpleContent>
                                    </xs:complexType>
                                </xs:element>
                            </xs:choice>
                        </xs:sequence>
                        <xs:attribute name="id" type="xs:int" use="required" />
                    </xs:complexType>
                </xs:element>
            </xs:sequence>
        </xs:complexType>
    </xs:element>
</xs:schema>